[
  {
    "name": "Mr. Curtis O'Conner-Rice",
    "phone": "231-088-0119",
    "service": "Indoor air quality assessment",
    "timestamp": "2026-03-30T08:02:36.773Z",
    "email": "Kevin_Windler@yahoo.com",
    "budget": 6355,
    "utm_source": "email_campaign"
  },
  {
    "name": "Cheryl Senger DDS",
    "phone": "186-815-7459",
    "service": "Heat pump service",
    "timestamp": "2026-03-27T15:40:40.119Z",
    "email": "Lesley_Boyer93@hotmail.com",
    "budget": 13831,
    "utm_source": "facebook"
  },
  {
    "name": "Roderick Carroll",
    "phone": "605-576-5040",
    "service": "Heat pump service",
    "timestamp": "2026-03-22T02:09:39.743Z",
    "email": "Gaston19@hotmail.com",
    "budget": 7286
  },
  {
    "name": "Martha Paucek",
    "phone": "855-995-4364",
    "service": "AC repair",
    "timestamp": "2026-03-30T02:52:30.286Z",
    "email": "Reece38@gmail.com",
    "budget": 10225,
    "utm_source": "email_campaign"
  },
  {
    "name": "Mr. Garry Purdy",
    "phone": "824-541-5746",
    "service": "Thermostat replacement",
    "timestamp": "2026-03-30T17:06:17.771Z",
    "email": "Eve.Kulas58@hotmail.com",
    "budget": 12290
  },
  {
    "name": "Dominic Rau",
    "phone": "820-292-7167",
    "service": "Indoor air quality assessment",
    "timestamp": "2026-03-23T05:26:37.657Z",
    "email": "Elouise_Bogan@hotmail.com",
    "budget": 2520
  },
  {
    "name": "Wilma Keebler",
    "phone": "399-705-5216",
    "service": "Ductless mini-split install",
    "timestamp": "2026-03-23T00:24:02.232Z",
    "email": "Dessie54@yahoo.com",
    "utm_source": "facebook"
  },
  {
    "name": "Ramon Hane I",
    "phone": "276-991-6072",
    "service": "Indoor air quality assessment",
    "timestamp": "2026-03-31T13:25:44.822Z",
    "email": "Lulu68@yahoo.com"
  },
  {
    "name": "Arturo O'Connell",
    "phone": "988-318-8784",
    "service": "AC maintenance",
    "timestamp": "2026-04-01T13:14:38.570Z",
    "email": "Alexandrine.Dickens@yahoo.com"
  },
  {
    "name": "Lauren Wolff",
    "phone": "066-787-3301",
    "service": "Heat pump service",
    "timestamp": "2026-04-01T16:31:10.076Z",
    "email": "Devante.Krajcik12@gmail.com",
    "budget": 10562
  },
  {
    "name": "Kyle Wisozk",
    "phone": "122-403-8246",
    "service": "AC repair",
    "timestamp": "2026-03-31T12:09:11.880Z",
    "email": "Cecelia_Kunze50@hotmail.com",
    "utm_source": "email_campaign"
  },
  {
    "name": "Steven Paucek",
    "phone": "049-014-1164",
    "service": "AC maintenance",
    "timestamp": "2026-03-19T23:26:01.363Z",
    "email": "Millie_Upton1@gmail.com",
    "utm_source": "google_organic"
  },
  {
    "name": "Jane Hane",
    "phone": "706-235-0093",
    "service": "AC repair",
    "timestamp": "2026-03-19T18:29:22.263Z",
    "email": "Izabella_Mayert6@gmail.com",
    "budget": 10932,
    "utm_source": "facebook"
  },
  {
    "name": "Damon Wehner",
    "phone": "062-178-4218",
    "service": "AC repair",
    "timestamp": "2026-04-01T07:34:28.092Z",
    "budget": 13953
  },
  {
    "name": "Luz Jacobi",
    "phone": "533-421-6186",
    "service": "No cool / emergency",
    "timestamp": "2026-03-18T16:59:05.044Z",
    "email": "Reva57@hotmail.com",
    "budget": 10260,
    "utm_source": "direct"
  },
  {
    "name": "Patti Ebert MD",
    "phone": "381-469-3731",
    "service": "No cool / emergency",
    "timestamp": "2026-03-21T08:18:24.947Z",
    "budget": 8368,
    "utm_source": "referral"
  },
  {
    "name": "Francis Harris",
    "phone": "088-964-7846",
    "service": "Thermostat replacement",
    "timestamp": "2026-03-20T17:32:38.630Z",
    "email": "Rowena.Crist35@gmail.com",
    "budget": 1786,
    "utm_source": "referral"
  },
  {
    "name": "Steven Crist",
    "phone": "084-214-1318",
    "service": "No cool / emergency",
    "timestamp": "2026-03-30T10:08:36.682Z",
    "email": "Titus.Rohan@yahoo.com",
    "budget": 5337,
    "utm_source": "email_campaign"
  },
  {
    "name": "Loren Jones",
    "phone": "755-126-9368",
    "service": "AC repair",
    "timestamp": "2026-03-23T16:24:04.952Z",
    "email": "Eve.Prohaska18@yahoo.com",
    "budget": 8237
  },
  {
    "name": "Ms. Dawn Schowalter",
    "phone": "957-254-7602",
    "service": "Indoor air quality assessment",
    "timestamp": "2026-03-23T07:02:34.058Z",
    "email": "Gardner.Nienow21@yahoo.com"
  },
  {
    "name": "Kimberly Heaney",
    "phone": "248-130-3279",
    "service": "Ductless mini-split install",
    "timestamp": "2026-03-21T14:57:20.753Z",
    "email": "Allie17@gmail.com",
    "budget": 12167
  },
  {
    "name": "Juan Bechtelar III",
    "phone": "326-502-2575",
    "service": "AC maintenance",
    "timestamp": "2026-03-22T15:36:08.804Z",
    "email": "Daren97@hotmail.com",
    "utm_source": "google_lsa"
  },
  {
    "name": "Miss Jamie Kihn",
    "phone": "749-593-9738",
    "service": "AC maintenance",
    "timestamp": "2026-03-23T08:09:12.998Z",
    "email": "Richmond82@hotmail.com",
    "budget": 8883,
    "utm_source": "facebook"
  },
  {
    "name": "Dr. Natasha Mante",
    "phone": "082-206-9954",
    "service": "AC repair",
    "timestamp": "2026-03-22T18:42:41.643Z",
    "email": "Jessy58@yahoo.com",
    "budget": 8528,
    "utm_source": "google_organic"
  },
  {
    "name": "Sheri Paucek",
    "phone": "319-602-5498",
    "service": "Furnace repair",
    "timestamp": "2026-03-23T21:13:54.450Z",
    "email": "Icie3@yahoo.com",
    "utm_source": "direct"
  },
  {
    "name": "Leah Predovic",
    "phone": "911-944-1500",
    "service": "No cool / emergency",
    "timestamp": "2026-03-29T22:12:47.794Z",
    "email": "Ettie.Willms@hotmail.com",
    "utm_source": "google_lsa"
  },
  {
    "name": "Catherine Lemke",
    "phone": "600-607-2034",
    "service": "AC repair",
    "timestamp": "2026-03-29T04:24:56.448Z",
    "email": "Sydney.Huels@yahoo.com",
    "utm_source": "email_campaign"
  },
  {
    "name": "Dr. Cornelius Kulas V",
    "phone": "697-499-0159",
    "service": "No cool / emergency",
    "timestamp": "2026-03-28T16:52:25.818Z",
    "email": "Berniece21@gmail.com",
    "budget": 12367,
    "utm_source": "referral"
  },
  {
    "name": "Ian Walker",
    "phone": "651-998-6854",
    "service": "Heat pump service",
    "timestamp": "2026-03-23T19:29:36.488Z",
    "budget": 6470,
    "utm_source": "google_lsa"
  },
  {
    "name": "Holly Rogahn",
    "phone": "374-583-8820",
    "service": "Furnace repair",
    "timestamp": "2026-03-24T08:37:53.252Z",
    "email": "Missouri5@hotmail.com",
    "budget": 13830,
    "utm_source": "direct"
  },
  {
    "name": "Kevin Pfeffer",
    "phone": "401-613-6170",
    "service": "Indoor air quality assessment",
    "timestamp": "2026-04-01T02:33:58.624Z",
    "budget": 16672
  },
  {
    "name": "Daisy Wilderman",
    "phone": "820-809-5622",
    "service": "Indoor air quality assessment",
    "timestamp": "2026-03-29T19:04:04.013Z",
    "email": "Korey_Keeling@yahoo.com",
    "budget": 16346,
    "utm_source": "google_lsa"
  },
  {
    "name": "Jimmy Legros",
    "phone": "409-538-4795",
    "service": "Furnace repair",
    "timestamp": "2026-03-29T09:25:38.436Z",
    "email": "Arnold_Feeney@yahoo.com",
    "budget": 14798,
    "utm_source": "referral"
  },
  {
    "name": "Ryan Maggio",
    "phone": "724-369-2493",
    "service": "Indoor air quality assessment",
    "timestamp": "2026-03-27T15:42:14.703Z",
    "email": "Devan32@yahoo.com",
    "budget": 1192
  },
  {
    "name": "Kristina Wyman",
    "phone": "329-428-5686",
    "service": "Heat pump service",
    "timestamp": "2026-03-27T02:52:13.673Z",
    "email": "Jaida_Walker47@hotmail.com",
    "utm_source": "google_organic"
  },
  {
    "name": "Josephine Spencer",
    "phone": "352-226-0751",
    "service": "Heat pump service",
    "timestamp": "2026-03-22T21:19:57.484Z",
    "email": "Orie.Kuhic90@yahoo.com",
    "budget": 11710,
    "utm_source": "referral"
  },
  {
    "name": "Elvira Ziemann-Thiel",
    "phone": "715-733-6451",
    "service": "Indoor air quality assessment",
    "timestamp": "2026-03-26T21:21:14.460Z",
    "email": "Thea86@yahoo.com",
    "utm_source": "google_lsa"
  },
  {
    "name": "Steve Volkman",
    "phone": "768-558-1294",
    "service": "Furnace repair",
    "timestamp": "2026-03-27T05:42:04.069Z",
    "utm_source": "google_organic"
  },
  {
    "name": "Luther McCullough",
    "phone": "609-232-3621",
    "service": "Furnace repair",
    "timestamp": "2026-03-24T00:14:12.625Z",
    "budget": 10569
  },
  {
    "name": "Jan Stehr",
    "phone": "724-115-2173",
    "service": "Furnace repair",
    "timestamp": "2026-03-28T07:29:48.253Z",
    "email": "Jeanette8@hotmail.com"
  },
  {
    "name": "Carla Kohler",
    "phone": "347-825-7949",
    "service": "AC maintenance",
    "timestamp": "2026-03-27T21:47:31.924Z",
    "email": "Cora.Romaguera12@yahoo.com",
    "budget": 13592
  },
  {
    "name": "Olivia Rutherford",
    "phone": "570-610-0416",
    "service": "Ductless mini-split install",
    "timestamp": "2026-03-31T04:44:31.050Z",
    "email": "Domenic.Wuckert@gmail.com",
    "budget": 8834,
    "utm_source": "google_organic"
  },
  {
    "name": "Tyler Donnelly",
    "phone": "709-474-6052",
    "service": "No cool / emergency",
    "timestamp": "2026-03-18T23:42:13.201Z",
    "budget": 5045,
    "utm_source": "direct"
  },
  {
    "name": "Mike Hand IV",
    "phone": "884-057-3237",
    "service": "AC maintenance",
    "timestamp": "2026-04-01T15:16:12.188Z",
    "email": "Amya76@hotmail.com",
    "utm_source": "direct"
  },
  {
    "name": "Jo Kautzer",
    "phone": "642-922-6258",
    "service": "Ductless mini-split install",
    "timestamp": "2026-03-22T18:25:09.602Z",
    "email": "Isac_Spencer4@yahoo.com",
    "budget": 2162,
    "utm_source": "referral"
  },
  {
    "name": "Pat Hoppe",
    "phone": "149-226-0570",
    "service": "No cool / emergency",
    "timestamp": "2026-03-23T00:51:29.445Z",
    "email": "Jamir.Larkin@gmail.com",
    "budget": 12581,